"sprint_number","sprint_name","sprint_goal","start_date","end_date","duration_days","total_story_points","estimated_hours","team_capacity_hours","capacity_utilization","task_count","epic_coverage","key_deliverables","demo_objectives","success_criteria","risk_factors","mitigation_strategies","dependencies_resolved","team_members","external_dependencies","integration_windows","review_schedule","retrospective_date","burndown_target"
"1","Sprint 1: Foundations - Admin Registration & Security","Establish a secure, multi-tenant foundation. Enable the first Admin to register their organization, log in, and be protected by basic security policies.","2024-10-21","2024-11-01","10","23","224","280","80%","13","Tenant & User Lifecycle Management","Public registration page; Secure login/logout flow; Forgot password flow; Core security rules; Role-based routing.","Successfully register a new organization; Log in as the new Admin; Demonstrate password complexity and account lockout.","All 'Must Have' stories for the sprint are completed and demo-ready; All security rule tests pass.","Complexity of atomic registration logic (RISK-001); Correct implementation of core security rules.","Extensive integration testing with Firebase Emulator; Peer review of all security-related code.","true","backend.dev1@company.com,frontend.dev1@company.com,frontend.dev2@company.com,qa.engineer1@company.com","","Continuous integration with Firebase Emulator.","Sprint review on 2024-11-01 at 2 PM","2024-11-01","Linear burndown with 50% completion by day 5"
"2","Sprint 2: User Onboarding & Team Structure","Build the complete user invitation and registration flow, and establish team structure management.","2024-11-04","2024-11-15","10","25","240","280","86%","12","Tenant & User Lifecycle Management","Admin 'Invite User' flow; Invitation email system; Registration completion page; Admin 'Create Team' flow.","Admin invites a new user; Invited user receives email and completes registration; Admin creates a new team and assigns a supervisor.","Full user invitation-to-activation loop is functional and secure.","Email deliverability (spam filters); Secure handling of invitation tokens.","Use a reputable email provider (SendGrid); Secure token generation and server-side validation.","true","backend.dev1@company.com,backend.dev2@company.com,frontend.dev1@company.com,qa.engineer1@company.com","SendGrid API","Integration testing of email flow with Mailtrap/SendGrid sandbox.","Sprint review on 2024-11-15 at 2 PM","2024-11-15","Linear burndown"
"3","Sprint 3: Core Mobile Experience & Permissions","Implement the core Subordinate workflow for attendance marking, including online/offline support and accessibility.","2024-11-18","2024-11-29","10","21","200","280","71%","10","Core Attendance Workflow, User Experience","Mobile dashboard for Subordinate; Check-in/out functionality; Location permission flow; Basic accessibility setup.","Subordinate logs into mobile app; Grants location permissions; Successfully performs a check-in and a check-out.","Core attendance marking is functional and reliable on both iOS and Android.","Inconsistent GPS performance on different devices; Platform-specific permission handling nuances.","Test on a wide range of physical devices; Use a mature permissions-handling library.","true","frontend.dev1@company.com,frontend.dev2@company.com,qa.engineer1@company.com","Device GPS hardware","E2E testing on physical devices throughout the sprint.","Sprint review on 2024-11-29 at 2 PM","2024-11-29","Linear burndown"
"4","Sprint 4: Offline Capability & Reliability","Make the core mobile experience robust and reliable by implementing offline support and user feedback for sync issues.","2024-12-02","2024-12-13","10","23","224","280","80%","9","Core Attendance Workflow, User Experience","Offline check-in/out capability; Automatic data sync on reconnect; Persistent failure notifications with manual retry.","Perform check-in in airplane mode; Reconnect and show data syncs; Demonstrate the persistent failure banner and retry mechanism.","Attendance data is never lost due to network issues; User is always aware of data sync status.","Silent loss of offline data (RISK-002); Complexity of testing network failure scenarios.","Implement auxiliary local DB for sync tracking; Dedicate significant QA time to manual testing with network manipulation tools.","true","frontend.dev1@company.com,frontend.dev2@company.com,qa.engineer1@company.com","","Focus on E2E tests simulating various offline and intermittent connectivity scenarios.","Sprint review on 2024-12-13 at 2 PM","2024-12-13","Linear burndown"
"5","Sprint 5: Supervisor MVP - Approval Workflow","Launch the minimum viable product for the Supervisor role, enabling them to manage their team's attendance records.","2024-12-16","2024-12-27","10","20","192","280","69%","10","Core Attendance Workflow, Tenant & User Lifecycle Management","Supervisor mobile dashboard; Pending approval list; Single approve/reject actions; UI for flagged records.","Admin creates a team and assigns members; Subordinate checks in; Supervisor logs in and sees the pending record; Supervisor approves/rejects the record.","The full attendance lifecycle from creation to supervisor approval is functional.","Incorrect security rules allowing supervisors to see other teams' data.","Rigorous automated testing of all Firestore Security Rules for the Supervisor role.","true","backend.dev2@company.com,frontend.dev1@company.com,frontend.dev2@company.com,qa.engineer1@company.com","","E2E testing of the full Subordinate -> Supervisor workflow.","Sprint review on 2024-12-27 at 2 PM","2024-12-27","Linear burndown"